{
  "schema": "centinela/report/1.0",
  "event": {
    "usgs_id": "us6000tymj",
    "mag": 5.6,
    "depth_km": 8.0,
    "utc": "2026-09-30T21:55:27Z",
    "lugar": "94 km al SO de Tamarindo, Costa Rica",
    "pager_alert": "green",
    "lon": -86.5063,
    "lat": 9.7526
  },
  "inputs": {
    "shakemap_version": 6,
    "groundfailure_version": 0,
    "exposure_manifest": "cri-v0.4",
    "modelo_deslizamiento": "",
    "modelo_licuefaccion": ""
  },
  "preliminar": false,
  "radios": [
    {
      "radio_km": 25,
      "pop": 0.0
    },
    {
      "radio_km": 50,
      "pop": 0.0
    },
    {
      "radio_km": 100,
      "pop": 22441.707517703064
    }
  ],
  "backtest": false,
  "totales": {
    "pop_mmi6p": 0.0,
    "pop_mmi7p": 0.0,
    "pop_mmi8p": 0.0,
    "pop_65p_mmi7p": 0.0,
    "pop_65p_mmi6p": 0.0,
    "bld_mmi6p": 0.0,
    "built_m2_mmi6p": 0.0,
    "health_mmi6p": 0.0,
    "edu_mmi6p": 0.0,
    "road_km_mmi6p": 0.0,
    "road_km_principal_mmi6p": 0.0,
    "bld_mmi7p": 0.0,
    "built_m2_mmi7p": 0.0,
    "health_mmi7p": 0.0,
    "edu_mmi7p": 0.0,
    "road_km_mmi7p": 0.0,
    "road_km_principal_mmi7p": 0.0,
    "pop_ls_alta": 0.0,
    "pop_lq_alta": 0.0
  },
  "top_municipios": [],
  "incertidumbre": {
    "pop_discrepancia_pct": null,
    "notas": [
      "El epicentro está a 87 km de la población más cercana del país con la que se comparó. La sacudida no alcanzó territorio habitado."
    ]
  },
  "ground_failure_usgs": {
    "ls_alerta_usgs": "",
    "ls_pop_usgs": "",
    "lq_alerta_usgs": "",
    "lq_pop_usgs": ""
  },
  "descargas": {
    "geoparquet": "",
    "pmtiles": "",
    "csv_adm2": "adm2.csv",
    "mapa_png": "mapa_general.png"
  },
  "changelog": [
    "ShakeMap: v5 → v6",
    "Ninguna cifra publicada cambia frente a la versión anterior."
  ],
  "licencia": {
    "cubo": "odbl",
    "spdx": "ODbL-1.0",
    "texto": "Este derivado contiene datos bajo Open Database License (ODbL) 1.0 y se publica bajo esa misma licencia (ODbL §4.4). Al redistribuirlo hay que conservar este aviso y las atribuciones listadas arriba (ODbL §4.3).",
    "manifiesto_url": "https://github.com/sforero77/CENTINELA/blob/main/data/manifests/CRI.yaml",
    "atribuciones": [
      {
        "titulo": "USGS Earthquake Hazards Program",
        "licencia": "public-domain-usgov",
        "url": "https://earthquake.usgs.gov/"
      },
      {
        "titulo": "JRC / Comisión Europea — GHS-POP y GHS-BUILT-S (GHSL R2023A)",
        "licencia": "EC-reuse-attribution",
        "url": "https://ghsl.jrc.ec.europa.eu/"
      },
      {
        "titulo": "WorldPop, University of Southampton",
        "licencia": "CC-BY-4.0",
        "url": "https://www.worldpop.org/"
      },
      {
        "titulo": "Overture Maps Foundation",
        "licencia": "ODbL-1.0",
        "url": "https://overturemaps.org/"
      },
      {
        "titulo": "© OpenStreetMap contributors",
        "licencia": "ODbL-1.0",
        "url": "https://www.openstreetmap.org/copyright"
      },
      {
        "titulo": "OCHA — Common Operational Datasets (COD-AB), vía HDX",
        "licencia": "CC-BY-IGO",
        "url": "https://data.humdata.org/"
      },
      {
        "titulo": "Humanitarian OpenStreetMap Team (HOT), vía HDX",
        "licencia": "ODbL-1.0",
        "url": "https://www.hotosm.org/"
      },
      {
        "titulo": "ESA WorldCover 2021 v200 (Zanaga et al.)",
        "licencia": "CC-BY-4.0",
        "url": "https://esa-worldcover.org/"
      }
    ]
  },
  "disclaimers": [
    "Exposición estimada, no daño observado.",
    "Este sistema no es una alerta temprana ni una recomendación de evacuación.",
    "No reemplaza a los servicios geológicos ni a las unidades de gestión del riesgo.",
    "Fuentes, vintages y versiones consumidas: ver manifiesto enlazado."
  ],
  "generado_utc": "2026-10-02T11:18:28Z",
  "pipeline_version": "0.1.0"
}
