{
  "schema": "centinela/report/1.0",
  "event": {
    "usgs_id": "us70003t2n",
    "mag": 6.6,
    "depth_km": 57.92,
    "utc": "2019-05-30T09:03:32Z",
    "lugar": "32 km al S de La Libertad, El Salvador",
    "pager_alert": "yellow",
    "lon": -89.3056,
    "lat": 13.1994
  },
  "inputs": {
    "shakemap_version": 1,
    "groundfailure_version": 6,
    "exposure_manifest": "slv-v0.3",
    "modelo_deslizamiento": "nowicki_2014_global_model.tif",
    "modelo_licuefaccion": "zhu_2017_general_model.tif"
  },
  "preliminar": false,
  "radios": [],
  "backtest": true,
  "totales": {
    "pop_mmi6p": 66269.33582028653,
    "pop_mmi7p": 0.0,
    "pop_mmi8p": 0.0,
    "pop_65p_mmi7p": 0.0,
    "pop_65p_mmi6p": 4250.669961259775,
    "bld_mmi6p": 33997.0,
    "built_m2_mmi6p": 4887326.0,
    "health_mmi6p": 2.0,
    "edu_mmi6p": 3.0,
    "road_km_mmi6p": 782.9937263447881,
    "road_km_principal_mmi6p": 58.06079856497582,
    "bld_mmi7p": 0.0,
    "built_m2_mmi7p": 0.0,
    "health_mmi7p": 0.0,
    "edu_mmi7p": 0.0,
    "road_km_mmi7p": 0.0,
    "road_km_principal_mmi7p": 0.0,
    "pop_ls_alta": 1122.8564099725336,
    "pop_lq_alta": 21098.49125910923
  },
  "top_municipios": [
    {
      "adm2_id": "SV06003",
      "nombre": "La Paz Oeste",
      "mmi_max": 6.0,
      "pop_mmi7p": 0.0,
      "pop_banda": 45419.331734268926
    },
    {
      "adm2_id": "SV05002",
      "nombre": "La Libertad Costa",
      "mmi_max": 6.0,
      "pop_mmi7p": 0.0,
      "pop_banda": 9970.592273000628
    },
    {
      "adm2_id": "SV06001",
      "nombre": "La Paz Centro",
      "mmi_max": 6.0,
      "pop_mmi7p": 0.0,
      "pop_banda": 7390.775697121397
    },
    {
      "adm2_id": "SV10005",
      "nombre": "San Salvador Sur",
      "mmi_max": 6.0,
      "pop_mmi7p": 0.0,
      "pop_banda": 3488.636115895584
    },
    {
      "adm2_id": "SV10001",
      "nombre": "San Salvador Centro",
      "mmi_max": 5.5,
      "pop_mmi7p": 0.0,
      "pop_banda": 0.0
    },
    {
      "adm2_id": "SV06002",
      "nombre": "La Paz Este",
      "mmi_max": 5.5,
      "pop_mmi7p": 0.0,
      "pop_banda": 0.0
    },
    {
      "adm2_id": "SV04002",
      "nombre": "Cuscatlán Sur",
      "mmi_max": 5.5,
      "pop_mmi7p": 0.0,
      "pop_banda": 0.0
    },
    {
      "adm2_id": "SV05003",
      "nombre": "La Libertad Este",
      "mmi_max": 5.5,
      "pop_mmi7p": 0.0,
      "pop_banda": 0.0
    },
    {
      "adm2_id": "SV02002",
      "nombre": "Cabañas Oeste",
      "mmi_max": 5.5,
      "pop_mmi7p": 0.0,
      "pop_banda": 0.0
    },
    {
      "adm2_id": "SV10002",
      "nombre": "San Salvador Este",
      "mmi_max": 5.5,
      "pop_mmi7p": 0.0,
      "pop_banda": 0.0
    },
    {
      "adm2_id": "SV10899",
      "nombre": "Lago de Llopango",
      "mmi_max": 5.5,
      "pop_mmi7p": 0.0,
      "pop_banda": 0.0
    },
    {
      "adm2_id": "SV11001",
      "nombre": "San Vicente Norte",
      "mmi_max": 5.5,
      "pop_mmi7p": 0.0,
      "pop_banda": 0.0
    },
    {
      "adm2_id": "SV04001",
      "nombre": "Cuscatlán Norte",
      "mmi_max": 5.5,
      "pop_mmi7p": 0.0,
      "pop_banda": 0.0
    },
    {
      "adm2_id": "SV11002",
      "nombre": "San Vicente Sur",
      "mmi_max": 5.5,
      "pop_mmi7p": 0.0,
      "pop_banda": 0.0
    },
    {
      "adm2_id": "SV05006",
      "nombre": "La Libertad Sur",
      "mmi_max": 5.5,
      "pop_mmi7p": 0.0,
      "pop_banda": 0.0
    }
  ],
  "incertidumbre": {
    "pop_discrepancia_pct": 13.1,
    "notas": []
  },
  "ground_failure_usgs": {
    "ls_alerta_usgs": "green",
    "ls_pop_usgs": "25",
    "lq_alerta_usgs": "orange",
    "lq_pop_usgs": "17000"
  },
  "descargas": {
    "geoparquet": "",
    "pmtiles": "",
    "csv_adm2": "adm2.csv",
    "mapa_png": "mapa_general.png"
  },
  "changelog": [],
  "licencia": {
    "cubo": "odbl",
    "spdx": "ODbL-1.0",
    "texto": "Este derivado contiene datos bajo Open Database License (ODbL) 1.0 y se publica bajo esa misma licencia (ODbL §4.4). Al redistribuirlo hay que conservar este aviso y las atribuciones listadas arriba (ODbL §4.3).",
    "manifiesto_url": "https://github.com/sforero77/CENTINELA/blob/main/data/manifests/SLV.yaml",
    "atribuciones": [
      {
        "titulo": "USGS Earthquake Hazards Program",
        "licencia": "public-domain-usgov",
        "url": "https://earthquake.usgs.gov/"
      },
      {
        "titulo": "JRC / Comisión Europea — GHS-POP y GHS-BUILT-S (GHSL R2023A)",
        "licencia": "EC-reuse-attribution",
        "url": "https://ghsl.jrc.ec.europa.eu/"
      },
      {
        "titulo": "WorldPop, University of Southampton",
        "licencia": "CC-BY-4.0",
        "url": "https://www.worldpop.org/"
      },
      {
        "titulo": "Overture Maps Foundation",
        "licencia": "ODbL-1.0",
        "url": "https://overturemaps.org/"
      },
      {
        "titulo": "© OpenStreetMap contributors",
        "licencia": "ODbL-1.0",
        "url": "https://www.openstreetmap.org/copyright"
      },
      {
        "titulo": "OCHA — Common Operational Datasets (COD-AB), vía HDX",
        "licencia": "CC-BY-IGO",
        "url": "https://data.humdata.org/"
      },
      {
        "titulo": "Humanitarian OpenStreetMap Team (HOT), vía HDX",
        "licencia": "ODbL-1.0",
        "url": "https://www.hotosm.org/"
      },
      {
        "titulo": "ESA WorldCover 2021 v200 (Zanaga et al.)",
        "licencia": "CC-BY-4.0",
        "url": "https://esa-worldcover.org/"
      }
    ]
  },
  "disclaimers": [
    "Exposición estimada, no daño observado.",
    "Este sistema no es una alerta temprana ni una recomendación de evacuación.",
    "No reemplaza a los servicios geológicos ni a las unidades de gestión del riesgo.",
    "Fuentes, vintages y versiones consumidas: ver manifiesto enlazado."
  ],
  "generado_utc": "2026-09-28T15:43:56Z",
  "pipeline_version": "0.1.0"
}
