{
  "schema": "centinela/report/1.0",
  "event": {
    "usgs_id": "us2000cjfy",
    "mag": 7.1,
    "depth_km": 39.0,
    "utc": "2018-01-14T09:18:45Z",
    "lugar": "37 km al O de Atiquipa, Perú",
    "pager_alert": "green",
    "lon": -74.7092,
    "lat": -15.7675
  },
  "inputs": {
    "shakemap_version": 1,
    "groundfailure_version": 0,
    "exposure_manifest": "per-v0.4",
    "modelo_deslizamiento": "",
    "modelo_licuefaccion": ""
  },
  "preliminar": false,
  "radios": [],
  "backtest": true,
  "totales": {
    "pop_mmi6p": 36933.04225536436,
    "pop_mmi7p": 0.0,
    "pop_mmi8p": 0.0,
    "pop_65p_mmi7p": 0.0,
    "pop_65p_mmi6p": 3059.639328004802,
    "bld_mmi6p": 40910.0,
    "built_m2_mmi6p": 2493102.0,
    "health_mmi6p": 22.0,
    "edu_mmi6p": 126.0,
    "road_km_mmi6p": 1682.8366399455742,
    "road_km_principal_mmi6p": 337.4181201052885,
    "bld_mmi7p": 0.0,
    "built_m2_mmi7p": 0.0,
    "health_mmi7p": 0.0,
    "edu_mmi7p": 0.0,
    "road_km_mmi7p": 0.0,
    "road_km_principal_mmi7p": 0.0,
    "pop_ls_alta": 0.0,
    "pop_lq_alta": 0.0
  },
  "top_municipios": [
    {
      "adm2_id": "PE0403",
      "nombre": "Caraveli",
      "mmi_max": 6.5,
      "pop_mmi7p": 0.0,
      "pop_banda": 24069.96234550327
    },
    {
      "adm2_id": "PE1103",
      "nombre": "Nasca",
      "mmi_max": 6.0,
      "pop_mmi7p": 0.0,
      "pop_banda": 12863.079909861088
    },
    {
      "adm2_id": "PE0507",
      "nombre": "Parinacochas",
      "mmi_max": 6.0,
      "pop_mmi7p": 0.0,
      "pop_banda": 0.0
    },
    {
      "adm2_id": "PE0506",
      "nombre": "Lucanas",
      "mmi_max": 6.0,
      "pop_mmi7p": 0.0,
      "pop_banda": 0.0
    },
    {
      "adm2_id": "PE1101",
      "nombre": "Ica",
      "mmi_max": 5.0,
      "pop_mmi7p": 0.0,
      "pop_banda": 0.0
    },
    {
      "adm2_id": "PE1104",
      "nombre": "Palpa",
      "mmi_max": 5.0,
      "pop_mmi7p": 0.0,
      "pop_banda": 0.0
    }
  ],
  "incertidumbre": {
    "pop_discrepancia_pct": 11.7,
    "notas": []
  },
  "ground_failure_usgs": {
    "ls_alerta_usgs": "",
    "ls_pop_usgs": "",
    "lq_alerta_usgs": "",
    "lq_pop_usgs": ""
  },
  "descargas": {
    "geoparquet": "",
    "pmtiles": "",
    "csv_adm2": "adm2.csv",
    "mapa_png": "mapa_general.png"
  },
  "changelog": [],
  "licencia": {
    "cubo": "odbl",
    "spdx": "ODbL-1.0",
    "texto": "Este derivado contiene datos bajo Open Database License (ODbL) 1.0 y se publica bajo esa misma licencia (ODbL §4.4). Al redistribuirlo hay que conservar este aviso y las atribuciones listadas arriba (ODbL §4.3).",
    "manifiesto_url": "https://github.com/sforero77/CENTINELA/blob/main/data/manifests/PER.yaml",
    "atribuciones": [
      {
        "titulo": "USGS Earthquake Hazards Program",
        "licencia": "public-domain-usgov",
        "url": "https://earthquake.usgs.gov/"
      },
      {
        "titulo": "JRC / Comisión Europea — GHS-POP y GHS-BUILT-S (GHSL R2023A)",
        "licencia": "EC-reuse-attribution",
        "url": "https://ghsl.jrc.ec.europa.eu/"
      },
      {
        "titulo": "WorldPop, University of Southampton",
        "licencia": "CC-BY-4.0",
        "url": "https://www.worldpop.org/"
      },
      {
        "titulo": "Overture Maps Foundation",
        "licencia": "ODbL-1.0",
        "url": "https://overturemaps.org/"
      },
      {
        "titulo": "© OpenStreetMap contributors",
        "licencia": "ODbL-1.0",
        "url": "https://www.openstreetmap.org/copyright"
      },
      {
        "titulo": "OCHA — Common Operational Datasets (COD-AB), vía HDX",
        "licencia": "CC-BY-IGO",
        "url": "https://data.humdata.org/"
      },
      {
        "titulo": "Humanitarian OpenStreetMap Team (HOT), vía HDX",
        "licencia": "ODbL-1.0",
        "url": "https://www.hotosm.org/"
      },
      {
        "titulo": "ESA WorldCover 2021 v200 (Zanaga et al.)",
        "licencia": "CC-BY-4.0",
        "url": "https://esa-worldcover.org/"
      }
    ]
  },
  "disclaimers": [
    "Exposición estimada, no daño observado.",
    "Este sistema no es una alerta temprana ni una recomendación de evacuación.",
    "No reemplaza a los servicios geológicos ni a las unidades de gestión del riesgo.",
    "Fuentes, vintages y versiones consumidas: ver manifiesto enlazado."
  ],
  "generado_utc": "2026-09-28T15:41:20Z",
  "pipeline_version": "0.1.0"
}
