{
  "schema": "centinela/report/1.0",
  "event": {
    "usgs_id": "us6000u1cf",
    "mag": 6.0,
    "depth_km": 10.0,
    "utc": "2026-10-10T04:14:01Z",
    "lugar": "4 km al NNE de La Tronosa, Panamá",
    "pager_alert": "yellow",
    "lon": -80.5728,
    "lat": 7.4777
  },
  "inputs": {
    "shakemap_version": 5,
    "groundfailure_version": 4,
    "exposure_manifest": "pan-v0.5",
    "modelo_deslizamiento": "jessee_2018_model.tif",
    "modelo_licuefaccion": "zhu_2017_general_model.tif",
    "shakemap_fuente": "us",
    "groundfailure_fuente": "us"
  },
  "preliminar": false,
  "radios": [],
  "backtest": false,
  "totales": {
    "pop_mmi6p": 10191.903860664926,
    "pop_mmi7p": 1729.8265856597573,
    "pop_mmi8p": 0.0,
    "pop_65p_mmi7p": 343.4271011237713,
    "pop_65p_mmi6p": 1817.3557217138314,
    "bld_mmi6p": 7548.0,
    "built_m2_mmi6p": 1332033.0,
    "health_mmi6p": 1.0,
    "edu_mmi6p": 4.0,
    "road_km_mmi6p": 480.89368473768724,
    "road_km_principal_mmi6p": 58.55872462125455,
    "bld_mmi7p": 1202.0,
    "built_m2_mmi7p": 208249.0,
    "health_mmi7p": 0.0,
    "edu_mmi7p": 1.0,
    "road_km_mmi7p": 75.92791451212646,
    "road_km_principal_mmi7p": 18.4748407851227,
    "pop_ls_alta": 0.0,
    "pop_lq_alta": 3431.8310107523575
  },
  "top_municipios": [
    {
      "adm2_id": "PA0907",
      "nombre": "Tonosí",
      "mmi_max": 7.0,
      "pop_mmi7p": 1673.1804587263614,
      "pop_banda": 1673.1804587263614
    },
    {
      "adm2_id": "PA0904",
      "nombre": "Macaracas",
      "mmi_max": 7.0,
      "pop_mmi7p": 56.64612693339586,
      "pop_banda": 56.64612693339586
    },
    {
      "adm2_id": "PA0703",
      "nombre": "Los Pozos",
      "mmi_max": 6.0,
      "pop_mmi7p": 0.0,
      "pop_banda": 0.0
    },
    {
      "adm2_id": "PA0902",
      "nombre": "Las Tablas",
      "mmi_max": 6.0,
      "pop_mmi7p": 0.0,
      "pop_banda": 0.0
    },
    {
      "adm2_id": "PA1306",
      "nombre": "Mariato",
      "mmi_max": 5.5,
      "pop_mmi7p": 0.0,
      "pop_banda": 0.0
    },
    {
      "adm2_id": "PA0901",
      "nombre": "Guararé",
      "mmi_max": 5.5,
      "pop_mmi7p": 0.0,
      "pop_banda": 0.0
    },
    {
      "adm2_id": "PA0706",
      "nombre": "Pesé",
      "mmi_max": 5.0,
      "pop_mmi7p": 0.0,
      "pop_banda": 0.0
    },
    {
      "adm2_id": "PA0702",
      "nombre": "Las Minas",
      "mmi_max": 5.0,
      "pop_mmi7p": 0.0,
      "pop_banda": 0.0
    },
    {
      "adm2_id": "PA0906",
      "nombre": "Pocrí",
      "mmi_max": 5.0,
      "pop_mmi7p": 0.0,
      "pop_banda": 0.0
    },
    {
      "adm2_id": "PA0903",
      "nombre": "Los Santos",
      "mmi_max": 5.0,
      "pop_mmi7p": 0.0,
      "pop_banda": 0.0
    }
  ],
  "incertidumbre": {
    "pop_discrepancia_pct": 10.8,
    "notas": []
  },
  "ground_failure_usgs": {
    "ls_alerta_usgs": "yellow",
    "ls_pop_usgs": "5",
    "lq_alerta_usgs": "yellow",
    "lq_pop_usgs": "1000"
  },
  "descargas": {
    "geoparquet": "",
    "pmtiles": "",
    "csv_adm2": "adm2.csv",
    "mapa_png": "mapa_general.png"
  },
  "changelog": [
    "ShakeMap: v4 (us) → v5 (us)",
    "Ground Failure: v3 (us) → v4 (us)",
    "Epicentro: reubicado 4 km",
    "Población en MMI≥6: 12 mil → 10 mil",
    "Población en MMI≥7: 1.500 → 1.700",
    "Población de 65 años o más en MMI≥7: 290 → 340",
    "Edificaciones en MMI≥7: 1.000 → 1.200",
    "ShakeMap: v3 (us) → v4 (us)",
    "Ground Failure: v2 (us) → v3 (us)",
    "Ninguna cifra publicada cambia frente a la versión anterior.",
    "ShakeMap: v2 (us) → v3 (us)",
    "Ground Failure: v1 (us) → v2 (us)",
    "Ninguna cifra publicada cambia frente a la versión anterior.",
    "ShakeMap: v1 (us) → v2 (us)",
    "Ground Failure: v0 → v1 (us)",
    "Población en cobertura areal alta por licuefacción: 0 → 3.400",
    "ShakeMap: v0 → v1 (us)",
    "Población en MMI≥6: 0 → 12 mil",
    "Población en MMI≥7: 0 → 1.500",
    "Población de 65 años o más en MMI≥7: 0 → 290",
    "Edificaciones en MMI≥7: 0 → 1.000",
    "Sedes educativas en MMI≥7: 0 → 1"
  ],
  "licencia": {
    "cubo": "odbl",
    "spdx": "ODbL-1.0",
    "texto": "Este derivado contiene datos bajo Open Database License (ODbL) 1.0 y se publica bajo esa misma licencia (ODbL §4.4). Al redistribuirlo hay que conservar este aviso y las atribuciones listadas arriba (ODbL §4.3).",
    "manifiesto_url": "https://github.com/sforero77/CENTINELA/blob/main/data/manifests/PAN.yaml",
    "atribuciones": [
      {
        "titulo": "USGS Earthquake Hazards Program",
        "licencia": "public-domain-usgov",
        "url": "https://earthquake.usgs.gov/"
      },
      {
        "titulo": "JRC / Comisión Europea — GHS-POP y GHS-BUILT-S (GHSL R2023A)",
        "licencia": "EC-reuse-attribution",
        "url": "https://ghsl.jrc.ec.europa.eu/"
      },
      {
        "titulo": "WorldPop, University of Southampton",
        "licencia": "CC-BY-4.0",
        "url": "https://www.worldpop.org/"
      },
      {
        "titulo": "Overture Maps Foundation",
        "licencia": "ODbL-1.0",
        "url": "https://overturemaps.org/"
      },
      {
        "titulo": "© OpenStreetMap contributors",
        "licencia": "ODbL-1.0",
        "url": "https://www.openstreetmap.org/copyright"
      },
      {
        "titulo": "OCHA — Common Operational Datasets (COD-AB), vía HDX",
        "licencia": "CC-BY-IGO",
        "url": "https://data.humdata.org/"
      },
      {
        "titulo": "Humanitarian OpenStreetMap Team (HOT), vía HDX",
        "licencia": "ODbL-1.0",
        "url": "https://www.hotosm.org/"
      },
      {
        "titulo": "ESA WorldCover 2021 v200 (Zanaga et al.)",
        "licencia": "CC-BY-4.0",
        "url": "https://esa-worldcover.org/"
      }
    ]
  },
  "disclaimers": [
    "Exposición estimada, no daño observado.",
    "Este sistema no es una alerta temprana ni una recomendación de evacuación.",
    "No reemplaza a los servicios geológicos ni a las unidades de gestión del riesgo.",
    "Fuentes, vintages y versiones consumidas: ver manifiesto enlazado."
  ],
  "generado_utc": "2026-10-30T11:34:39Z",
  "pipeline_version": "0.1.0"
}
